Name,Title,_Artist1,_Artist2,_Artist3,_Artist4,_Artist5,url,Type,Lyric,Video,Christmas,Live,Remix,Cover,id,Start,End,Uploader,Duration
Pulp - Do You Remember The First Time? Lyrics Hd,Do You Remember The First Time?,Pulp,,,,,https://www.youtube.com/watch?v=lFZd7JL5c2w,Lyric,1,0,0,0,0,0,lFZd7JL5c2w,0.0,0.0,Youpidou Channel,259
Pulp - Like A Friend (Lyrics),Like A Friend,Pulp,,,,,https://www.youtube.com/watch?v=tm1sKABBoto,Lyric,1,0,0,0,0,0,tm1sKABBoto,0.0,0.0,Cheyenne X,241
Pulp - This Is Hardcore (Hq) (Lyrics On-Screen),This Is Hardcore On,Pulp,,,,,https://www.youtube.com/watch?v=UzK-UmrxefY,Lyric,1,0,0,0,0,0,UzK-UmrxefY,0.0,0.0,Droic Antimorph,387
Another One Bites The Dust - Queen (Lyrics),Another One Bites The Dust,Queen,,,,,https://www.youtube.com/watch?v=jotlA1v8htQ,Lyric,1,0,0,0,0,0,jotlA1v8htQ,0.0,0.0,Marcus Acton-Bond,212
Queen - Bicycle Race (Lyrics),Bicycle Race,Queen,,,,,https://www.youtube.com/watch?v=gWJ8_B9BVxo,Lyric,1,0,0,0,0,0,gWJ8_B9BVxo,0.0,0.0,Fritzes007,184
Queen - Bohemian Rhapsody (With Lyrics),Bohemian Rhapsody,Queen,,,,,https://www.youtube.com/watch?v=axAtWjn3MfI,Lyric,1,0,0,0,0,0,axAtWjn3MfI,0.0,0.0,Emma Cassell,355
Queen Crazy Little Thing Called Love With Lyrics,Crazy Little Thing Called Love,Queen,,,,,https://www.youtube.com/watch?v=18sbJPKCo7Y,Lyric,1,0,0,0,0,0,18sbJPKCo7Y,0.0,0.0,Stijnboy01,174
Queen - Dont Stop Me Now (Lyrics).,Dont Stop Me Now,Queen,,,,,https://www.youtube.com/watch?v=KKny_ia8Fvo,Lyric,1,0,0,0,0,0,KKny_ia8Fvo,0.0,0.0,Pongaplayandsing,212
Queen Fat Bottomed Girls With Lyrics,Fat Bottomed Girls,Queen,,,,,https://www.youtube.com/watch?v=qBk8MnT-Tvk,Lyric,1,0,0,0,0,0,qBk8MnT-Tvk,0.0,0.0,Rockbigfan,260
Queen - Fat Bottomed Girls (Official Video),Fat Bottomed Girls,Queen,,,,,https://www.youtube.com/watch?v=VMnjF1O4eH0,Video,0,1,0,0,0,0,VMnjF1O4eH0,0.0,0.0,Queen Official,231
Queen - Flash'S Theme (Lyrics),Flash's Theme,Queen,,,,,https://www.youtube.com/watch?v=t5rWtZI-AB8,Lyric,1,0,0,0,0,0,t5rWtZI-AB8,0.0,0.0,Fritzes007,211
Queen - Friends Will Be Friends (Lyrics),Friends Will Be Friends,Queen,,,,,https://www.youtube.com/watch?v=DAQ4sJZ5IsU,Lyric,1,0,0,0,0,0,DAQ4sJZ5IsU,0.0,0.0,Fritzes007,246
Queen - Good Old-Fashioned Lover Boy (Lyrics),Good Old Fashioned Lover Boy,Queen,,,,,https://www.youtube.com/watch?v=iNuN6k8GE1c,Lyric,1,0,0,0,0,0,iNuN6k8GE1c,0.0,0.0,Fritzes007,176
Queen - Hammer To Fall (Lyrics),Hammer To Fall,Queen,,,,,https://www.youtube.com/watch?v=n9PCXVZto18,Lyric,1,0,0,0,0,0,n9PCXVZto18,0.0,0.0,Fritzes007,269
Queen - Headlong (Lyrics),Headlong,Queen,,,,,https://www.youtube.com/watch?v=wVb63JXVh1U,Lyric,1,0,0,0,0,0,wVb63JXVh1U,0.0,0.0,Fritzes007,278
Queen - I Want It All (Official Video),I Want It All,Queen,,,,,https://www.youtube.com/watch?v=hFDcoX7s6rE,Video,0,1,0,0,0,0,hFDcoX7s6rE,0.0,0.0,Queen Official,249
Queen - I Want It All (Lyrics),I Want It All,Queen,,,,,https://www.youtube.com/watch?v=Odkv4aE3pTI,Lyric,1,0,0,0,0,0,Odkv4aE3pTI,0.0,0.0,Thekillerqueenie,277
Queen - I Want To Break Free Lyrics,I Want To Break Free,Queen,,,,,https://www.youtube.com/watch?v=GBthBQ-cKJA,Lyric,1,0,0,0,0,0,GBthBQ-cKJA,0.0,0.0,Awesomelyricsofsongs,257
Queen - I Was Born To Love You Lyrics,I Was Born To Love You,Queen,,,,,https://www.youtube.com/watch?v=3AxUoE2k-IQ,Lyric,1,0,0,0,0,0,3AxUoE2k-IQ,0.0,0.0,Owen Madaeen,289
Queen - I'M Going Slightly Mad (Lyrics),I'm Going Slightly Mad,Queen,,,,,https://www.youtube.com/watch?v=hn4k6TE-C4Y,Lyric,1,0,0,0,0,0,hn4k6TE-C4Y,0.0,0.0,Fritzes007,252
Queen - Innuendo (Lyrics),Innuendo,Queen,,,,,https://www.youtube.com/watch?v=BaCLWt0EVUM,Lyric,1,0,0,0,0,0,BaCLWt0EVUM,0.0,0.0,Fritzes007,392
Queen - Is This The World We Created...? (Lyrics),Is This The World We Created ?,Queen,,,,,https://www.youtube.com/watch?v=tVKTcWp_W9k,Lyric,1,0,0,0,0,0,tVKTcWp_W9k,0.0,0.0,Fritzes007,139
Queen - It'S A Hard Life (Lyrics),It’s A Hard Life,Queen,,,,,https://www.youtube.com/watch?v=XgNzxqrngU8,Lyric,1,0,0,0,0,0,XgNzxqrngU8,0.0,0.0,Fritzes007,250
Queen - Jealousy (Lyrics),Jealousy,Queen,,,,,https://www.youtube.com/watch?v=t5ZGAeoEng8,Lyric,1,0,0,0,0,0,t5ZGAeoEng8,0.0,0.0,Fritzes007,194
Queen - Killer Queen (Lyrics),Killer Queen,Queen,,,,,https://www.youtube.com/watch?v=aSQwI3rDETk,Lyric,1,0,0,0,0,0,aSQwI3rDETk,0.0,0.0,Fritzes007,182
Queen - Love Of My Life (Lyrics),Love Of My Life,Queen,,,,,https://www.youtube.com/watch?v=p9woC3Mrq9w,Lyric,1,0,0,0,0,0,p9woC3Mrq9w,0.0,0.0,Fritzes007,219
Queen - One Year Of Love (Lyrics),One Year Of Love,Queen,,,,,https://www.youtube.com/watch?v=RG_kerFL6yE,Lyric,1,0,0,0,0,0,RG_kerFL6yE,0.0,0.0,Fritzes007,269
Queen - Play The Game (Lyrics),Play The Game,Queen,,,,,https://www.youtube.com/watch?v=Lr2iDWQSwsI,Lyric,1,0,0,0,0,0,Lr2iDWQSwsI,0.0,0.0,Fritzes007,214
Queen - Princes Of The Universe (Lyrics),Princes Of The Universe,Queen,,,,,https://www.youtube.com/watch?v=zZ1WyBGG_Vw,Lyric,1,0,0,0,0,0,zZ1WyBGG_Vw,0.0,0.0,Fritzes007,212
Queen - Radio Ga Ga (Official Lyric Video),Radio Ga Ga,Queen,,,,,https://www.youtube.com/watch?v=pMYCOYjIKrE,Lyric,1,0,0,0,0,0,pMYCOYjIKrE,0.0,0.0,Queen Official,347
Queens Of The Stoneage - Everybody Knows That You'Re Insane Lyrics,S Of The Stoneage Everybody Knows That You're Insane,Queen,,,,,https://www.youtube.com/watch?v=_7P7NI1JM7o,Lyric,1,0,0,0,0,0,_7P7NI1JM7o,0.0,0.0,Ralyn Parkhill,254
Queen - Sail Away Sweet Sister (To The Sister I Never Had) (Lyrics),Sail Away Sweet Sister To The Sister I Never Had,Queen,,,,,https://www.youtube.com/watch?v=LQxXgmnS_yM,Lyric,1,0,0,0,0,0,LQxXgmnS_yM,0.0,0.0,Fritzes007,213
Queen - Somebody To Love (Official Video),Somebody To Love,Queen,,,,,https://www.youtube.com/watch?v=kijpcUv-b8M,Video,0,1,0,0,0,0,kijpcUv-b8M,0.0,0.0,Queen Official,310
Queen - Somebody To Love (Lyrics),Somebody To Love,Queen,,,,,https://www.youtube.com/watch?v=zj69iA_goIk,Lyric,1,0,0,0,0,0,zj69iA_goIk,0.0,0.0,Pongaplayandsing,298
Queen - Spread Your Wings (Lyrics),Spread Your Wings,Queen,,,,,https://www.youtube.com/watch?v=ZvNQ3WJs_BM,Lyric,1,0,0,0,0,0,ZvNQ3WJs_BM,0.0,0.0,Fritzes007,275
Queen - The Miracle (Lyrics),The Miracle,Queen,,,,,https://www.youtube.com/watch?v=K80HN7rInvw,Lyric,1,0,0,0,0,0,K80HN7rInvw,0.0,0.0,Fritzes007,295
Queen - The Show Must Go On (Lyrics),The Show Must Go On,Queen,,,,,https://www.youtube.com/watch?v=fBOvOatPqnY,Lyric,1,0,0,0,0,0,fBOvOatPqnY,0.0,0.0,Fritzes007,268
Queen - These Are The Days Of Our Lives (Lyrics),These Are The Days Of Our Lives,Queen,,,,,https://www.youtube.com/watch?v=LukqdKFfXl4,Lyric,1,0,0,0,0,0,LukqdKFfXl4,0.0,0.0,Electromen,247
Queen - These Are The Days Of Our Lives (Official Video),These Are The Days Of Our Lives,Queen,,,,,https://www.youtube.com/watch?v=oB4K0scMysc,Video,0,1,0,0,0,0,oB4K0scMysc,0.0,0.0,Queen Official,252
Queen - Tie Your Mother Down (Lyrics),Tie Your Mother Down,Queen,,,,,https://www.youtube.com/watch?v=QGDGwDnJvps,Lyric,1,0,0,0,0,0,QGDGwDnJvps,0.0,0.0,Fritzes007,288
Queen - Too Much Love Will Kill You (Lyrics),Too Much Love Will Kill You,Queen,,,,,https://www.youtube.com/watch?v=IL9h1SD_2FA,Lyric,1,0,0,0,0,0,IL9h1SD_2FA,0.0,0.0,Fritzes007,260
Queen - Under Pressure (Lyrics),Under Pressure,Queen,,,,,https://www.youtube.com/watch?v=BWdLt3Afjrg,Lyric,1,0,0,0,0,0,BWdLt3Afjrg,0.0,0.0,Fritzes007,249
Queen - We Are The Champions Lyrics,We Are The Champions,Queen,,,,,https://www.youtube.com/watch?v=O71fetlkCZo,Lyric,1,0,0,0,0,0,O71fetlkCZo,0.0,0.0,Aughrisbuzz,186
We Will Rock You - Queen- Lyrics,We Will Rock You,Queen,,,,,https://www.youtube.com/watch?v=onJQ1dpsAF8,Lyric,1,0,0,0,0,0,onJQ1dpsAF8,0.0,0.0,Jenny Sørflaten,128
Queen - Who Wants To Live Forever (Lyrics),Who Wants To Live Forever,Queen,,,,,https://www.youtube.com/watch?v=_TsOPjZEF6E,Lyric,1,0,0,0,0,0,_TsOPjZEF6E,0.0,0.0,Fritzes007,317
Queen - You Take My Breath Away (Lyrics),You Take My Breath Away,Queen,,,,,https://www.youtube.com/watch?v=g_1omWwSrFU,Lyric,1,0,0,0,0,0,g_1omWwSrFU,0.0,0.0,Fritzes007,309
Queens Of The Stone Age - First It Giveth - Lyrics (Hq),First It Giveth,Queens Of The Stone Age,,,,,https://www.youtube.com/watch?v=qwDEI34W_eA,Lyric,1,0,0,0,0,0,qwDEI34W_eA,0.0,0.0,Emily Watkins,201
Queens Of The Stone Age - Go With The Flow | Lyrics!,Go With The Flow,Queens Of The Stone Age,,,,,https://www.youtube.com/watch?v=UUrAe5ZTCFA,Lyric,1,0,0,0,0,0,UUrAe5ZTCFA,0.0,0.0,Bunitnation,187
Queens Of The Stone Age - I Sat By The Ocean (Lyrics Video),I Sat By The Ocean,Queens Of The Stone Age,,,,,https://www.youtube.com/watch?v=ZPiOfk9BGD8,Lyric,1,0,0,0,0,0,ZPiOfk9BGD8,0.0,0.0,Tom,256
Queens Of The Stone Age - In My Head Lyrics,In My Head,Queens Of The Stone Age,,,,,https://www.youtube.com/watch?v=firQic9NxiI,Lyric,1,0,0,0,0,0,firQic9NxiI,0.0,0.0,Blackshiep,235
Queens Of The Stone Age – Like A Drug (With Lyrics),Like A Drug,Queens Of The Stone Age,,,,,https://www.youtube.com/watch?v=YWja4AZjqnY,Lyric,1,0,0,0,0,0,YWja4AZjqnY,0.0,0.0,Jim Geo,196
Queens Of The  Stone Age Little Sister Lyrics,Little Sister,Queens Of The Stone Age,,,,,https://www.youtube.com/watch?v=w7_CDanzxys,Lyric,1,0,0,0,0,0,w7_CDanzxys,0.0,0.0,Santoy Mosh,175
No One Knows,No One Knows,Queens Of The Stone Age,,,,,https://www.youtube.com/watch?v=xez7wGxROUU,Lyric,1,0,0,0,0,0,xez7wGxROUU,0.0,0.0,Queens Of The Stone Age - Topic,254
Its The End Of The World By R.E.M Lyrics,Its The End Of The World,R E M,,,,,https://www.youtube.com/watch?v=JsxavPANO8s,Lyric,1,0,0,0,0,0,JsxavPANO8s,0.0,0.0,Rob Williams,251
R.E.M. - Losing My Religion (Lyrics),Losing My Religion,R E M,,,,,https://www.youtube.com/watch?v=u036M7p6-ak,Lyric,1,0,0,0,0,0,u036M7p6-ak,0.0,0.0,Xxxxxtotallyscenexxx,269
R.I.O. Feat. Nicco - Party Shaker (Official Video Hd),Party Shaker,R I O Nicco,,,,,https://www.youtube.com/watch?v=8sPj0Ic8KQ8,Video,0,1,0,0,0,0,8sPj0Ic8KQ8,0.0,0.0,Kontor.Tv,211
R3Hab X Moti - Up All Night Ft. Fiora (Official Video),X Up All Night Fiora,R3Hab,Moti,,,,https://www.youtube.com/watch?v=MeaLc5gIuYw,Video,0,1,0,0,0,0,MeaLc5gIuYw,0.0,0.0,R3Hab,165
Fight Song - Rachel Platten (Lyrics),Fight Song,Rachel Platten,,,,,https://www.youtube.com/watch?v=EZxO7Uy2E-g,Lyric,1,0,0,0,0,0,EZxO7Uy2E-g,0.0,0.0,Dopelyrics,211
"Calvin Harris, Rag'N'Bone Man - Giant (Lyrics)",Giant,Rag'N'Bone Man,Calvin Harris,,,,https://www.youtube.com/watch?v=1xoap1yv2SA,Lyric,1,0,0,0,0,0,1xoap1yv2SA,0.0,0.0,Mrcl Songs,230
Rag'N'Bone Man - Human Lyrics,Human,Rag'N'Bone Man,,,,,https://www.youtube.com/watch?v=RpimiNvcRC4,Lyric,1,0,0,0,0,0,RpimiNvcRC4,0.0,0.0,Lyrics Worldwide,199
Machine Gun Kelly - Killing In The Name (Rage Against The Machine Cover),Killing In The Name Cover,Rage Against The Machine,Machine Gun Kelly,,,,https://www.youtube.com/watch?v=vBTQFByJWiE,Lyric,1,0,0,0,0,1,vBTQFByJWiE,0.0,0.0,Machine Gun Kelly,228
Blitzkrieg Bop Ramones Lyrics,Blitzkrieg Bop,Ramones,,,,,https://www.youtube.com/watch?v=HvOleioAp34,Lyric,1,0,0,0,0,0,HvOleioAp34,0.0,0.0,Megajoeyramone,135
Calm Before The Storm With Lyrics,Calm Before The Storm,Random,,,,,https://www.youtube.com/watch?v=dHnWmn6VXao,Lyric,1,0,0,0,0,0,dHnWmn6VXao,0.0,0.0,Freedomformusic,268
Red Hot Chili Peppers - Californication [Official Music Video],Californication,Red Hot Chili Peppers,,,,,https://www.youtube.com/watch?v=YlUKcNNmywk,Video,0,1,0,0,0,0,YlUKcNNmywk,0.0,0.0,Red Hot Chili Peppers,321
"""Californication"" - Red Hot Chili Peppers (Cover By First To Eleven)",Californication Cover,Red Hot Chili Peppers,First To Eleven,First To Eleven,,,https://www.youtube.com/watch?v=f1iW734wGns,Lyric,1,0,0,0,0,1,f1iW734wGns,0.0,0.0,First To Eleven,344
Red Hot Chili Peppers - Can'T Stop (Lyrics),Can't Stop,Red Hot Chili Peppers,,,,,https://www.youtube.com/watch?v=B4jSt0ne1ck,Lyric,1,0,0,0,0,0,B4jSt0ne1ck,0.0,0.0,Chili World,275
Red Hot Chili Peppers - Dani California Lyrics),Dani California,Red Hot Chili Peppers,,,,,https://www.youtube.com/watch?v=QZmM4YeSu8g,Lyric,1,0,0,0,0,0,QZmM4YeSu8g,0.0,0.0,Chili World,282
Red Hot Chili Peppers - Give It Away (Lyrics),Give It Away,Red Hot Chili Peppers,,,,,https://www.youtube.com/watch?v=exCEcmLw-Hc,Lyric,1,0,0,0,0,0,exCEcmLw-Hc,0.0,0.0,Chili World,288
Red Hot Chili Peppers - Otherside (Lyrics),Otherside,Red Hot Chili Peppers,,,,,https://www.youtube.com/watch?v=_m7_xZN8D7M,Lyric,1,0,0,0,0,0,_m7_xZN8D7M,0.0,0.0,Chili World,257
Red Hot Chilli Peppers Californication Lyrics,Red Hot Chilli Peppers Californication,Red Hot Chili Peppers,,,,,https://www.youtube.com/watch?v=LV34GMYLXcA,Lyric,1,0,0,0,0,0,LV34GMYLXcA,0.0,0.0,Mikey Moore,315
Red Hot Chili Peppers - Snow (Hey Oh) (Lyrics),Snow Hey Oh,Red Hot Chili Peppers,,,,,https://www.youtube.com/watch?v=KvlqclaxyP4,Lyric,1,0,0,0,0,0,KvlqclaxyP4,0.0,0.0,Chili World,335
Under The Bridge - Red Hot Chili Peppers Lyrics,Under The Bridge,Red Hot Chili Peppers,,,,,https://www.youtube.com/watch?v=vNqYRCYXcjw,Lyric,1,0,0,0,0,0,vNqYRCYXcjw,0.0,0.0,Smash_Is_Back,264
Redbone - Come And Get Your Love ( Lyrics ),Come And Get Your Love,Redbone,,,,,https://www.youtube.com/watch?v=6zdyYi8CABc,Lyric,1,0,0,0,0,0,6zdyYi8CABc,0.0,0.0,Creators Inc,207
Regard- Ride It Lyrics,Ride It,Regard,,,,,https://www.youtube.com/watch?v=v-s4uLaaMBc,Lyric,1,0,0,0,0,0,v-s4uLaaMBc,0.0,0.0,Viral Music,184
"Regard, Raye - Secrets (Official Video)",Secrets,Regard,Raye,,,,https://www.youtube.com/watch?v=nPLN5HXsq04,Video,0,1,0,0,0,0,nPLN5HXsq04,0.0,0.0,Regardvevo,181
Remady & Manu-L - Give Me Love (Official Video),Give Me Love,Remady Manu L,,,,,https://www.youtube.com/watch?v=tdU2Q6uIs0M,Video,0,1,0,0,0,0,tdU2Q6uIs0M,0.0,0.0,Remadymanulvevo,177
Remady & Manu-L - L.I.F.E.,L I F E,Remady Manu L,,,,,https://www.youtube.com/watch?v=d4M4aDJPYD8,Lyric,1,0,0,0,0,0,d4M4aDJPYD8,0.0,0.0,Remadymanulvevo,180
Rick Astley - Never Gonna Give You Up (Video),Never Gonna Give You Up,Rick Astley,,,,,https://www.youtube.com/watch?v=dQw4w9WgXcQ,Video,0,1,0,0,0,0,dQw4w9WgXcQ,0.0,0.0,Rickastleyvevo,212
Rick Astley Never Gonna Give You Up Lyrics!!!,Never Gonna Give You Up,Rick Astley,,,,,https://www.youtube.com/watch?v=6_b7RDuLwcI,Lyric,1,0,0,0,0,0,6_b7RDuLwcI,0.0,0.0,Jaysean,226
Never Gonna Give You Up - Rick Astley (Lyrics) 🎵,Never Gonna Give You Up,Rick Astley,,,,,https://www.youtube.com/watch?v=34Ig3X59_qA,Lyric,1,0,0,0,0,0,34Ig3X59_qA,0.0,0.0,Dopelyrics,247
Ricky Martin - Livin La Vida Loca | Lyrics,Livin La Vida Loca,Ricky Martin,,,,,https://www.youtube.com/watch?v=ltRgb4SJ1uk,Lyric,1,0,0,0,0,0,ltRgb4SJ1uk,0.0,0.0,Katoko,246
Shakira - Can'T Remember To Forget You Ft. Rihanna,Can't Remember To Forget You,Rihanna,Shakira,,,,https://www.youtube.com/watch?v=o3mP3mJDL2k,Lyric,1,0,0,0,0,0,o3mP3mJDL2k,0.0,0.0,Shakiravevo,206
Diamonds - Rihanna (Lyrics) 🎵,Diamonds,Rihanna,,,,,https://www.youtube.com/watch?v=EemxFDFpFTU,Lyric,1,0,0,0,0,0,EemxFDFpFTU,0.0,0.0,Dopelyrics,243
Don'T Stop The Music - Rihanna (Lyrics) 🎵,Don't Stop,Rihanna,,,,,https://www.youtube.com/watch?v=qT6I-UzC1mE,Lyric,1,0,0,0,0,0,qT6I-UzC1mE,0.0,0.0,Dopelyrics,307
Rihanna - Kiss It Better (Explicit),Kiss It Better,Rihanna,,,,,https://www.youtube.com/watch?v=49lY0HqqUVc,Lyric,1,0,0,0,0,0,49lY0HqqUVc,0.0,0.0,Rihannavevo,248
Eminem - Love The Way You Lie Ft. Rihanna,Love The Way You Lie,Rihanna,Eminem,,,,https://www.youtube.com/watch?v=uelHwf8o7_U,Lyric,0,1,0,0,0,0,uelHwf8o7_U,0.0,0.0,Eminemvevo,267
Eminem - Love The Way You Lie Ft. Rihanna ( Cover By J.Fla ),Love The Way You Lie Cover,Rihanna,Eminem,J Fla,J Fla,,https://www.youtube.com/watch?v=i5p51UDoW0U,Lyric,1,0,0,0,0,1,i5p51UDoW0U,0.0,0.0,Jflamusic,193
Rihanna - Love The Way You Lie (Part 2)( Cover By J.Fla ),Love The Way You Lie Part 2 Cover,Rihanna,J Fla,,,,https://www.youtube.com/watch?v=Se4hvXK3iP0,Lyric,1,0,0,0,0,1,Se4hvXK3iP0,0.0,0.0,Jflamusic,205
Rihanna - Only Girl (In The World) (Lyrics),Only Girl In The World,Rihanna,,,,,https://www.youtube.com/watch?v=rcvpf6LXQ2M,Lyric,1,0,0,0,0,0,rcvpf6LXQ2M,0.0,0.0,Audioandlyrics,239
Rihanna - Only Girl (In The World) (Official Music Video),Only Girl In The World,Rihanna,,,,,https://www.youtube.com/watch?v=pa14VNsdSYM,Video,0,1,0,0,0,0,pa14VNsdSYM,0.0,0.0,Rihannavevo,252
Rihanna - Pour It Up (Explicit),Pour It Up,Rihanna,,,,,https://www.youtube.com/watch?v=ehcVomMexkY,Lyric,0,1,0,0,0,0,ehcVomMexkY,0.0,0.0,Rihannavevo,196
Eminem Ft. Rihanna - The Monster ( Cover By J.Fla ),The Monster Cover,Rihanna,Eminem,J Fla,J Fla,,https://www.youtube.com/watch?v=7k8gO2nC9n0,Lyric,1,0,0,0,0,1,7k8gO2nC9n0,0.0,0.0,Jflamusic,170
Umbrella - Rihanna (Lyrics) Ft. Jay-Z,Umbrella,Rihanna,Jay Z,,,,https://www.youtube.com/watch?v=oVGRTQDqhs8,Lyric,1,0,0,0,0,0,oVGRTQDqhs8,0.0,0.0,Dopelyrics,318
Rita Ora - Anywhere (Official Video),Anywhere,Rita Ora,,,,,https://www.youtube.com/watch?v=ksdAs4LBRq8,Video,0,1,0,0,0,0,ksdAs4LBRq8,0.0,0.0,Rita Ora,222
Rita Ora - I Will Never Let You Down (Video),I Will Never Let You Down,Rita Ora,,,,,https://www.youtube.com/watch?v=50GQjUZ4P3M,Video,0,1,0,0,0,0,50GQjUZ4P3M,0.0,0.0,Ritaoravevo,208
Rita Ora - Let You Love Me [Official Video],Let You Love Me,Rita Ora,,,,,https://www.youtube.com/watch?v=XCQK6LmhYqc,Video,0,1,0,0,0,0,XCQK6LmhYqc,0.0,0.0,Rita Ora,190
Rita Ora - Let You Love Me (Lyrics),Let You Love Me,Rita Ora,,,,,https://www.youtube.com/watch?v=eY4t1Scl6LQ,Lyric,1,0,0,0,0,0,eY4t1Scl6LQ,0.0,0.0,Leader Of Lyrics,216
Rita Ora - R.I.P. Ft. Tinie Tempah (Official Video),R I P Tinie Tempah,Rita Ora,,,,,https://www.youtube.com/watch?v=L1l9WST5lXM,Video,0,1,0,0,0,0,L1l9WST5lXM,0.0,0.0,Ritaoravevo,231
Riva - Run Away (Insane & Stone Bootleg),Run Away Insane Stone Bootleg,Riva,,,,,https://www.youtube.com/watch?v=4jPzQiKCYm4,Lyric,1,0,0,0,0,0,4jPzQiKCYm4,0.0,0.0,Vdj Smile,180
Ro James - Permission (Official Music Video),Permission,Ro James,,,,,https://www.youtube.com/watch?v=qp1Pq2Fuw30,Video,0,1,0,0,0,0,qp1Pq2Fuw30,0.0,0.0,Rojamesvevo,281
Robbie Williams - Candy,Candy,Robbie Williams,,,,,https://www.youtube.com/watch?v=gtOV7bp-gys,Lyric,1,0,0,0,0,0,gtOV7bp-gys,0.0,0.0,Robbiewilliamsvevo,205
Robert Palmer Addicted To Love Lyrics,Addicted To Love,Robert Palmer,,,,,https://www.youtube.com/watch?v=PEs3lwcPO3k,Lyric,1,0,0,0,0,0,PEs3lwcPO3k,0.0,0.0,Yamada Jero,234
Robert Palmer - Bad Case Of Loving You Lyrics,Bad Case Of Loving You,Robert Palmer,,,,,https://www.youtube.com/watch?v=7z9DwMKvqcc,Lyric,1,0,0,0,0,0,7z9DwMKvqcc,0.0,0.0,Redrozes123,190
"Robin Thicke - Blurred Lines Ft. T.I., Pharrell (Official Music Video)",Blurred Lines,Robin Thicke,Robin Thicke,,,,https://www.youtube.com/watch?v=yyDUC1LUXSU,Video,0,1,0,0,0,0,yyDUC1LUXSU,0.0,0.0,Robinthickevevo,272
"Robin Thicke Feat. T.I, Pharrell - Blurred Lines (Lyrics Video)",Blurred Lines,Robin Thicke,,,,,https://www.youtube.com/watch?v=lVdde5KZqO4,Lyric,1,0,0,0,0,0,lVdde5KZqO4,0.0,0.0,Raineerickalyricsvideos,248
Robin Thicke - Blurred Lines Ft. T.I. & Pharrell (Unrated Version),Blurred Lines,Robin Thicke,,,,,https://www.youtube.com/watch?v=zwT6DZCQi9k,Lyric,1,0,0,0,0,0,zwT6DZCQi9k,0.0,0.0,Robinthickevevo,272
Rockwell - Somebody'S Watching Me (Official Music Video),Somebody's Watching Me,Rockwell,,,,,https://www.youtube.com/watch?v=7YvAYIJSSZY,Video,0,1,0,0,0,0,7YvAYIJSSZY,0.0,0.0,Rockwellvevo,216
Rockwell - Somebody'S Watching Me Lyrics,Somebody's Watching Me,Rockwell,,,,,https://www.youtube.com/watch?v=Y9mRl9tW3kE,Lyric,1,0,0,0,0,0,Y9mRl9tW3kE,0.0,0.0,Alana,237
Rockwell - Somebody`S Watching Me (Donk Remix),Somebody`s Watching Me Donk Remix,Rockwell,,,,,https://www.youtube.com/watch?v=C59oYgjzaO4,Lyric,1,0,0,0,1,0,C59oYgjzaO4,0.0,0.0,Yury C,219
Roger Sanchez Ft. Lisa Pure - Lost (Artur Montecci Remix) | Video Edit,Lost Remix,Roger Sanchez,Lisa Pure,Artur Montecci,,,https://www.youtube.com/watch?v=Aea5A4tR1hw,Video,0,1,0,0,1,0,Aea5A4tR1hw,0.0,0.0,Soundeo,289
Controller (Walker & Royce Remix),Controller Remix,Royce,,,,,https://www.youtube.com/watch?v=q-FojIbt_xc,Lyric,1,0,0,0,1,0,q-FojIbt_xc,0.0,0.0,Channel Tres,375
Rupert Holmes - (Escape) The Pina Colada Song (Lyrics),Escape The Pina Colada Song,Rupert Holmes,,,,,https://www.youtube.com/watch?v=Fsj2wdFDmLk,Lyric,1,0,0,0,0,0,Fsj2wdFDmLk,0.0,0.0,Luckyme531,278
Rüfüs Du Sol - Sundream (Official Video),Sundream,Rüfüs Du Sol,,,,,https://www.youtube.com/watch?v=vqhDkP-Je3E,Video,0,1,0,0,0,0,vqhDkP-Je3E,0.0,0.0,Rufusdusolvevo,298
Sabrina Carpenter - Looking At Me (Audio Only),Looking At Me Only,Sabrina Carpenter,,,,,https://www.youtube.com/watch?v=lu9Ylxc0IZM,Lyric,1,0,0,0,0,0,lu9Ylxc0IZM,0.0,0.0,Sabrinacarpentervevo,186
Saint Jhn (Imanbek Remix) Vs R3Hab & A Touch Of Class - All Around The Roses (Djs From Mars Bootleg),Imanbek Remix Vs A Touch Of Class All Around The Roses Djs From Mars Bootleg,Saint Jhn,R3Hab,,,,https://www.youtube.com/watch?v=7oLl7i0K-Us,Lyric,1,0,0,0,1,0,7oLl7i0K-Us,0.0,0.0,Djsfrommars,172
Sam Feldt X Lucas & Steve Feat. Wulf - Summer On You (Official Music Video),X Lucas Steve Wulf Summer On You,Sam Feldt,,,,,https://www.youtube.com/watch?v=Ey1_nkmS54g,Video,0,1,0,0,0,0,Ey1_nkmS54g,0.0,0.0,Spinnin' Records,160
"Dancing With A Stranger - Sam Smith, Normani (Lyrics)",Dancing With A Stranger,Sam Smith,Sam Smith,Normani,Normani,Normani,https://www.youtube.com/watch?v=wCxP4kLo3xE,Lyric,1,0,0,0,0,0,wCxP4kLo3xE,0.0,0.0,Dopelyrics,179
Sam Smith - Writing'S On The Wall ( Cover By J.Fla ),Writing's On The Wall Cover,Sam Smith,J Fla,,,,https://www.youtube.com/watch?v=hKVKdI9h7SY,Lyric,1,0,0,0,0,1,hKVKdI9h7SY,0.0,0.0,Jflamusic,193
"Sabrina, ♫ Boys (Summertime Love) Ⓞ Sabrina【1987】",Sabrina ♫ Boys Summertime Love Ⓞ Sabrina【1987】,Savrina,,,,,https://www.youtube.com/watch?v=QzXGOuVsA5w,Lyric,0,1,0,0,0,0,QzXGOuVsA5w,0.0,0.0,Pepe Ochentero,221
Sciccor Sister-I Don'T Feel Like Dancin' (Song+Lyrics),I Don't Feel Like Dancin' Song,Sciccor Sister,,,,,https://www.youtube.com/watch?v=b6RW-fPppe4,Lyric,1,0,0,0,0,0,b6RW-fPppe4,0.0,0.0,Chalm6,314
Elvis Ain'T Dead - Scouting For Girls - Lyrics,Elvis Ain't Dead,Scouting For Girls,,,,,https://www.youtube.com/watch?v=Mz6YaPTEe9M,Lyric,1,0,0,0,0,0,Mz6YaPTEe9M,0.0,0.0,Loadsalyricsandstuff,234
Scouting For Girls - Famous (Lyrics)!!,Famous,Scouting For Girls,,,,,https://www.youtube.com/watch?v=0kUko6cFHjQ,Lyric,1,0,0,0,0,0,0kUko6cFHjQ,0.0,0.0,Maniclyrics,154
Scouting For Girls - Heartbeat,Heartbeat,Scouting For Girls,,,,,https://www.youtube.com/watch?v=bP4jXD6bY_E,Lyric,1,0,0,0,0,0,bP4jXD6bY_E,0.0,0.0,Bp23011992,173
Scouting For Girls - James Bond,James Bond,Scouting For Girls,,,,,https://www.youtube.com/watch?v=3Ml1Bf5IGHY,Lyric,1,0,0,0,0,0,3Ml1Bf5IGHY,0.0,0.0,Ben Manuell,188
Scouting For Girls - Love How It Hurts Lyrics,Love How It Hurts,Scouting For Girls,,,,,https://www.youtube.com/watch?v=IyWZ0Huucig,Lyric,1,0,0,0,0,0,IyWZ0Huucig,0.0,0.0,Supernev395,190
Scouting For Girls - Millionaire (Lyrics),Millionaire,Scouting For Girls,,,,,https://www.youtube.com/watch?v=lUPgF_OWL5k,Lyric,1,0,0,0,0,0,lUPgF_OWL5k,0.0,178.0,Megan Oxtoby,281
On The Radio - Scouting For Girls (Lyrics),On The Radio,Scouting For Girls,,,,,https://www.youtube.com/watch?v=1v8CNR7Ac-0,Lyric,1,0,0,0,0,0,1v8CNR7Ac-0,0.0,0.0,Aclockworklaurenge,213
Scouting For Girls - She'S So Lovely Lyrics,She's So Lovely,Scouting For Girls,,,,,https://www.youtube.com/watch?v=l70FGwcm-E0,Lyric,1,0,0,0,0,0,l70FGwcm-E0,0.0,0.0,Xdogluvax,222
Snakes And Ladders - Scouting For Girls (Lyrics),Snakes And Ladders,Scouting For Girls,,,,,https://www.youtube.com/watch?v=qxxqYeKkmTI,Lyric,1,0,0,0,0,0,qxxqYeKkmTI,0.0,0.0,Wolfcubs Scoutingforgirls,257
Scouting For Girls- Summertime In The City- Lyrics,Summertime In The City,Scouting For Girls,,,,,https://www.youtube.com/watch?v=2wMtJePhv50,Lyric,1,0,0,0,0,0,2wMtJePhv50,0.0,0.0,Luke Tyson,185
Scouting For Girls - The Airplane Song,The Airplane Song,Scouting For Girls,,,,,https://www.youtube.com/watch?v=K7sHv9klMtg,Lyric,1,0,0,0,0,0,K7sHv9klMtg,0.0,0.0,Ben Manuell,182
Scouting For Girls - This Aint A Love Song (With Lyrics),This Aint A Love Song,Scouting For Girls,,,,,https://www.youtube.com/watch?v=INcCeEKS6iA,Lyric,1,0,0,0,0,0,INcCeEKS6iA,0.0,0.0,Imthelyricman,189
Without You - Scouting For Girls (Lyrics),Without You,Scouting For Girls,,,,,https://www.youtube.com/watch?v=RBex5VNNcK0,Lyric,1,0,0,0,0,0,RBex5VNNcK0,0.0,0.0,Wolfcubs Scoutingforgirls,248
Sean Finn Feat. Tinka - Summer Days (Ben Delay Remix Video Edit) (Official Video),Summer Days Ben Delay Remix,Sean Finn,Tinka,,,,https://www.youtube.com/watch?v=aeCNC0DvtZo,Video,0,1,0,0,1,0,aeCNC0DvtZo,0.0,0.0,Creamit,210
Sia - Cheap Thrills (Lyric Video) Ft. Sean Paul,Cheap Thrills,Sean Paul,Sia,,,,https://www.youtube.com/watch?v=nYh-n7EOtMA,Lyric,1,0,0,0,0,0,nYh-n7EOtMA,0.0,0.0,Siavevo,262
Selena Gomez - Back To You,Back To You,Selena Gomez,,,,,https://www.youtube.com/watch?v=VY1eFxgRR-k,Lyric,1,0,0,0,0,0,VY1eFxgRR-k,0.0,0.0,Selenagomezvevo,267
Selena Gomez ‒ Fetish (Lyrics) Ft. Gucci Mane,Fetish,Selena Gomez,Gucci Mane,,,,https://www.youtube.com/watch?v=2YlJHIbWZtA,Lyric,1,0,0,0,0,0,2YlJHIbWZtA,0.0,0.0,Taz Network,190
Selena Gomez - Good For You,Good For You,Selena Gomez,,,,,https://www.youtube.com/watch?v=1TsVjvEkc4s,Lyric,1,0,0,0,0,0,1TsVjvEkc4s,0.0,0.0,Selenagomezvevo,195
Selena Gomez - Good For You Ft. A$Ap Rocky (Official Audio),Good For You,Selena Gomez,A$Ap Rocky,,,,https://www.youtube.com/watch?v=Wp0hWIO8DiU,Lyric,1,0,0,0,0,0,Wp0hWIO8DiU,0.0,0.0,Selenagomezvevo,221
Zedd - I Want You To Know Ft. Selena Gomez (Official Music Video),I Want You To Know,Selena Gomez,Zedd,,,,https://www.youtube.com/watch?v=X46t8ZFqUB4,Video,0,1,0,0,0,0,X46t8ZFqUB4,0.0,0.0,Zeddvevo,247
Selena Gomez - Lose You To Love Me (Lyrics),Lose You To Love Me,Selena Gomez,,,,,https://www.youtube.com/watch?v=dLHE31RtPSU,Lyric,1,0,0,0,0,0,dLHE31RtPSU,0.0,0.0,Ylovesmusic,208
Selena Gomez - Love You Like A Love Song ( Cover By J.Fla ),Love You Like A Love Song Cover,Selena Gomez,J Fla,,,,https://www.youtube.com/watch?v=55zmJLagrDQ,Lyric,1,0,0,0,0,1,55zmJLagrDQ,0.0,0.0,Jflamusic,152
Selena Gomez - Rare (Official Music Video),Rare,Selena Gomez,,,,,https://www.youtube.com/watch?v=ia1iuXbEaYQ,Video,0,1,0,0,0,0,ia1iuXbEaYQ,0.0,0.0,Selenagomezvevo,224
